<?xml version="1.0" encoding="UTF-8" standalone="yes"?><!DOCTYPE root [
<!ELEMENT root (resource+, path*, time_point*, time_profile*, routed_job*, job*, job_op*, setup_removal_table*, machine*, platform*, connection*)>
<!ELEMENT resource (id_resource, name, resource_type, info1*, info2*)>
<!ELEMENT id_resource (#PCDATA)>
<!ELEMENT resource_type (#PCDATA)>
<!ELEMENT info1 (#PCDATA)>
<!ELEMENT info2 (#PCDATA)>
<!ELEMENT name (#PCDATA)>
<!ELEMENT path (id_path, resource_list_elem+)>
<!ELEMENT resource_list_elem (id_resource)>
<!ELEMENT id_path (#PCDATA)>
<!ELEMENT time_point (id_time_point, processing_time*, perishability_time*,release_no_timeshift*, release_time*, due_date_no_timeshift*, due_date_time*, deadline_no_timeshift*, deadline_time*, weight_obj*, setup_time*, removal_time*, dependent_setup_type*, dependent_removal_type*, route_booking_forward*, route_booking_backward*)>
<!ELEMENT id_time_point (#PCDATA)>
<!ELEMENT processing_time (#PCDATA)>
<!ELEMENT perishability_time (#PCDATA)>
<!ELEMENT release_no_timeshift (#PCDATA)>
<!ELEMENT release_time (#PCDATA)>
<!ELEMENT due_date_no_timeshift (#PCDATA)>
<!ELEMENT due_date_time (#PCDATA)>
<!ELEMENT deadline_no_timeshift (#PCDATA)>
<!ELEMENT deadline_time (#PCDATA)>
<!ELEMENT weight_obj (#PCDATA)>
<!ELEMENT setup_time (#PCDATA)>
<!ELEMENT removal_time (#PCDATA)>
<!ELEMENT dependent_setup_type (#PCDATA)>
<!ELEMENT dependent_removal_type (#PCDATA)>
<!ELEMENT route_booking_forward (#PCDATA)>
<!ELEMENT route_booking_backward (#PCDATA)>
<!ELEMENT time_profile (id_time_profile, id_path, time_point_list_elem+)>
<!ELEMENT time_point_list_elem (id_time_point)>
<!ELEMENT id_time_profile (#PCDATA)>
<!ELEMENT routed_job (id_routed_job, job_type, time_shift, id_time_profile, weight_obj*)>
<!ELEMENT routed_job_list_elem (id_routed_job)>
<!ELEMENT job (id_job, name, routed_job_list_elem+, multiple_routings_list_elem+)>
<!ELEMENT multiple_routings_list_elem (id_resource, time_profile_list_elem+)>
<!ELEMENT time_profile_list_elem (id_time_profile)>
<!ELEMENT id_job (#PCDATA)>
<!ELEMENT id_routed_job (#PCDATA)>
<!ELEMENT job_type (#PCDATA)>
<!ELEMENT time_shift (#PCDATA)>
<!ELEMENT job_op (id_job, operation+)>
<!ELEMENT operation (id_resource, time_point)>
<!ELEMENT setup_removal_table (table_entry+)>
<!ELEMENT table_entry (dependent_type1, dependent_type2,  setup_removal_type, dependent_time)>
<!ELEMENT dependent_type1 (#PCDATA)>
<!ELEMENT dependent_type2 (#PCDATA)>
<!ELEMENT setup_removal_type (#PCDATA)>
<!ELEMENT dependent_time (#PCDATA)>
<!ELEMENT machine (resource_list_elem+)>
<!ELEMENT platform (resource_list_elem+)>
<!ELEMENT connection (id_job_from, id_resource_from, id_job_to, id_resource_to, connection_weight, connection_price, is_passenger)>
<!ELEMENT id_job_from (#PCDATA)>
<!ELEMENT id_resource_from (#PCDATA)>
<!ELEMENT id_job_to (#PCDATA)>
<!ELEMENT id_resource_to (#PCDATA)>
<!ELEMENT connection_weight (#PCDATA)>
<!ELEMENT connection_price (#PCDATA)>
<!ELEMENT is_passenger (#PCDATA)>]><root><resource><id_resource>475</id_resource><name>ZB-BIL_255</name><resource_type>blocking</resource_type></resource><resource><id_resource>465</id_resource><name>WN_44</name><resource_type>blocking</resource_type></resource><resource><id_resource>159</id_resource><name>HG_4#macchina#S8_ZLOE-PF_std#190</name><resource_type>blocking</resource_type></resource><resource><id_resource>235</id_resource><name>WN_43</name><resource_type>blocking</resource_type></resource><resource><id_resource>589</id_resource><name>BAA_72</name><resource_type>blocking</resource_type></resource><resource><id_resource>712</id_resource><name>BAA_73</name><resource_type>blocking</resource_type></resource><resource><id_resource>627</id_resource><name>ZWIE_1</name><resource_type>blocking</resource_type></resource><resource><id_resource>34</id_resource><name>ZWIE_2</name><resource_type>blocking</resource_type></resource><resource><id_resource>63</id_resource><name>RI_2</name><resource_type>blocking</resource_type></resource><resource><id_resource>254</id_resource><name>UNT-MOLS_215</name><resource_type>blocking</resource_type></resource><resource><id_resource>464</id_resource><name>MH-WN_128</name><resource_type>blocking</resource_type></resource><resource><id_resource>516</id_resource><name>RI_1</name><resource_type>blocking</resource_type></resource><resource><id_resource>463</id_resource><name>MH-WN_127</name><resource_type>blocking</resource_type></resource><resource><id_resource>750</id_resource><name>20432#1</name><resource_type>multiple_routings</resource_type></resource><resource><id_resource>157</id_resource><name>HG_4#macchina#S8_ZLOE-PF_std#187</name><resource_type>blocking</resource_type></resource><resource><id_resource>21</id_resource><name>SBG-LITT_421_GreatScott_FullPath</name><resource_type>blocking</resource_type></resource><resource><id_resource>590</id_resource><name>BAA_82</name><resource_type>blocking</resource_type></resource><resource><id_resource>97</id_resource><name>SCAE-ZB_735#macchina#S4_UZ-SA-BU_std#330</name><resource_type>blocking</resource_type></resource><resource><id_resource>853</id_resource><name>ZUE_Kr13</name><resource_type>blocking</resource_type></resource><resource><id_resource>99</id_resource><name>SCAE-ZB_735#macchina#S4_UZ-SA-BU_std#335</name><resource_type>blocking</resource_type></resource><resource><id_resource>358</id_resource><name>RG_24</name><resource_type>blocking</resource_type></resource><resource><id_resource>711</id_resource><name>BAA_83</name><resource_type>blocking</resource_type></resource><resource><id_resource>149</id_resource><name>BRAG_3#macchina#RE_CH-ZUE_std#102</name><resource_type>blocking</resource_type></resource><resource><id_resource>459</id_resource><name>UNT-MG_120</name><resource_type>blocking</resource_type></resource><resource><id_resource>428</id_resource><name>LQ-ROR_409</name><resource_type>blocking</resource_type></resource><resource><id_resource>484</id_resource><name>RG_23</name><resource_type>blocking</resource_type></resource><resource><id_resource>148</id_resource><name>BRAG_3#macchina#RE_CH-ZUE_std#105</name><resource_type>blocking</resource_type></resource><resource><id_resource>23</id_resource><name>KIL_1#macchina#S8_ZLOE-PF_std#105</name><resource_type>blocking</resource_type></resource><resource><id_resource>27</id_resource><name>KIL_1#macchina#S8_ZLOE-PF_std#102</name><resource_type>blocking</resource_type></resource><resource><id_resource>80</id_resource><name>ZEN_1#macchina#S2_ZLOE-ZB_std#55</name><resource_type>blocking</resource_type></resource><resource><id_resource>382</id_resource><name>BRAG-MF_307</name><resource_type>blocking</resource_type></resource><resource><id_resource>71</id_resource><name>ZB-NOU_557</name><resource_type>blocking</resource_type></resource><resource><id_resource>81</id_resource><name>ZEN_1#macchina#S2_ZLOE-ZB_std#52</name><resource_type>blocking</resource_type></resource><resource><id_resource>216</id_resource><name>HURD_1</name><resource_type>blocking</resource_type></resource><resource><id_resource>106</id_resource><name>SCAE-ZB_735#macchina#S4_UZ-SA-BU_std#340</name><resource_type>blocking</resource_type></resource><resource><id_resource>107</id_resource><name>SCAE-ZB_735#macchina#S6_SCHD-ZB-RW_std#330</name><resource_type>blocking</resource_type></resource><resource><id_resource>86</id_resource><name>SCAE-ZB_735#macchina#S4_UZ-SA-BU_std#345</name><resource_type>blocking</resource_type></resource><resource><id_resource>105</id_resource><name>SCAE-ZB_735#macchina#S6_SCHD-ZB-RW_std#335</name><resource_type>blocking</resource_type></resource><resource><id_resource>125</id_resource><name>LQ_73#macchina#IC_CH-ZUE_std#70</name><resource_type>blocking</resource_type></resource><resource><id_resource>104</id_resource><name>SCAE-ZB_735#macchina#S6_SCHD-ZB-RW_std#337</name><resource_type>blocking</resource_type></resource><resource><id_resource>166</id_resource><name>HGO_4_GreatScott_FullPath</name><resource_type>blocking</resource_type></resource><resource><id_resource>421</id_resource><name>ZIZS-LQ_414</name><resource_type>blocking</resource_type></resource><resource><id_resource>422</id_resource><name>ZIZS-LQ_413</name><resource_type>blocking</resource_type></resource><resource><id_resource>433</id_resource><name>BRAG_23</name><resource_type>blocking</resource_type></resource><resource><id_resource>568</id_resource><name>BGH_2</name><resource_type>blocking</resource_type></resource><resource><id_resource>380</id_resource><name>BRAG_24</name><resource_type>blocking</resource_type></resource><resource><id_resource>353</id_resource><name>SIB-SCBU_145</name><resource_type>blocking</resource_type></resource><resource><id_resource>420</id_resource><name>ZIZS-LQ_416</name><resource_type>blocking</resource_type></resource><resource><id_resource>246</id_resource><name>TIEF-MG_222</name><resource_type>blocking</resource_type></resource><resource><id_resource>134</id_resource><name>MG_1#macchina#S4_BU-SA-UZ_std#237</name><resource_type>blocking</resource_type></resource><resource><id_resource>109</id_resource><name>PF_2-A#macchina#S40_EIS-RW_std#20</name><resource_type>blocking</resource_type></resource><resource><id_resource>600</id_resource><name>ZG_83</name><resource_type>blocking</resource_type></resource><resource><id_resource>825</id_resource><name>ZG_85</name><resource_type>blocking</resource_type></resource><resource><id_resource>354</id_resource><name>SIB-SCBU_146</name><resource_type>blocking</resource_type></resource><resource><id_resource>822</id_resource><name>ZG_84</name><resource_type>blocking</resource_type></resource><resource><id_resource>449</id_resource><name>FMS-WAL_112</name><resource_type>blocking</resource_type></resource><resource><id_resource>4</id_resource><name>HGO_94</name><resource_type>blocking</resource_type></resource><resource><id_resource>78</id_resource><name>ZEN_1</name><resource_type>blocking</resource_type></resource><resource><id_resource>679</id_resource><name>ZEN_2</name><resource_type>blocking</resource_type></resource><resource><id_resource>617</id_resource><name>ZUE_T31-A</name><resource_type>blocking</resource_type></resource><resource><id_resource>618</id_resource><name>ZUE_T31-B</name><resource_type>blocking</resource_type></resource><resource><id_resource>89</id_resource><name>SCAE-ZB_735#macchina#S4_UZ-SA-BU_std#350</name><resource_type>blocking</resource_type></resource><resource><id_resource>716</id_resource><name>LITT_91</name><resource_type>blocking</resource_type></resource><resource><id_resource>714</id_resource><name>BAA_63</name><resource_type>blocking</resource_type></resource><resource><id_resource>111</id_resource><name>LITT_92</name><resource_type>blocking</resource_type></resource><resource><id_resource>90</id_resource><name>SCAE-ZB_735#macchina#S4_UZ-SA-BU_std#355</name><resource_type>blocking</resource_type></resource><resource><id_resource>587</id_resource><name>BAA_62</name><resource_type>blocking</resource_type></resource><resource><id_resource>103</id_resource><name>SCAE-ZB_735#macchina#S6_SCHD-ZB-RW_std#325</name><resource_type>blocking</resource_type></resource><resource><id_resource>765</id_resource><name>ZUE_P52</name><resource_type>blocking</resource_type></resource><resource><id_resource>745</id_resource><name>ZUE_P55</name><resource_type>blocking</resource_type></resource><resource><id_resource>462</id_resource><name>MH-WN_126</name><resource_type>blocking</resource_type></resource><resource><id_resource>633</id_resource><name>ZEN_61</name><resource_type>blocking</resource_type></resource><resource><id_resource>271</id_resource><name>MELS-SA_201</name><resource_type>blocking</resource_type></resource><resource><id_resource>261</id_resource><name>FMS_84</name><resource_type>blocking</resource_type></resource><resource><id_resource>448</id_resource><name>FMS_83</name><resource_type>blocking</resource_type></resource><resource><id_resource>678</id_resource><name>ZEN_62</name><resource_type>blocking</resource_type></resource><resource><id_resource>820</id_resource><name>ZG_W58</name><resource_type>blocking</resource_type></resource><resource><id_resource>819</id_resource><name>ZG_W53</name><resource_type>blocking</resource_type></resource><resource><id_resource>868</id_resource><name>ZG_W55</name><resource_type>blocking</resource_type></resource><resource><id_resource>16</id_resource><name>RG_4</name><resource_type>blocking</resource_type></resource><resource><id_resource>598</id_resource><name>ZG_W54</name><resource_type>blocking</resource_type></resource><resource><id_resource>829</id_resource><name>ZG_W56</name><resource_type>blocking</resource_type></resource><resource><id_resource>120</id_resource><name>RG_3</name><resource_type>blocking</resource_type></resource><resource><id_resource>307</id_resource><name>ORD-HG_113</name><resource_type>blocking</resource_type></resource><resource><id_resource>723</id_resource><name>20434#1</name><resource_type>multiple_routings</resource_type></resource><resource><id_resource>328</id_resource><name>HAF_81</name><resource_type>blocking</resource_type></resource><resource><id_resource>218</id_resource><name>RW_7</name><resource_type>blocking</resource_type></resource><resource><id_resource>508</id_resource><name>PF-FRB_233</name><resource_type>blocking</resource_type></resource><resource><id_resource>477</id_resource><name>BIL_3</name><resource_type>blocking</resource_type></resource><resource><id_resource>514</id_resource><name>HAF_82</name><resource_type>blocking</resource_type></resource><resource><id_resource>365</id_resource><name>BIL_4</name><resource_type>blocking</resource_type></resource><resource><id_resource>509</id_resource><name>PF-FRB_232</name><resource_type>blocking</resource_type></resource><resource><id_resource>179</id_resource><name>AU-WAE_121#macchina#EC_ZUE-BU_std#175</name><resource_type>blocking</resource_type></resource><resource><id_resource>693</id_resource><name>ZUE_T34-A</name><resource_type>blocking</resource_type></resource><resource><id_resource>694</id_resource><name>ZUE_T34-B</name><resource_type>blocking</resource_type></resource><resource><id_resource>624</id_resource><name>ZAU_11</name><resource_type>blocking</resource_type></resource><resource><id_resource>585</id_resource><name>HGO_73</name><resource_type>blocking</resource_type></resource><resource><id_resource>687</id_resource><name>ZAU_12</name><resource_type>blocking</resource_type></resource><resource><id_resource>284</id_resource><name>ZAU_14</name><resource_type>blocking</resource_type></resource><resource><id_resource>169</id_resource><name>TW_4#macchina#S8_ZLOE-PF_std#504</name><resource_type>blocking</resource_type></resource><resource><id_resource>558</id_resource><name>ZAU_15</name><resource_type>blocking</resource_type></resource><resource><id_resource>133</id_resource><name>HGO_74</name><resource_type>blocking</resource_type></resource><resource><id_resource>746</id_resource><name>ZUE_P35</name><resource_type>blocking</resource_type></resource><resource><id_resource>182</id_resource><name>AU-WAE_121#macchina#RE_ZUE-CH_std#175</name><resource_type>blocking</resource_type></resource><resource><id_resource>256</id_resource><name>MOLS-WAL_214</name><resource_type>blocking</resource_type></resource><resource><id_resource>173</id_resource><name>ZG_5#macchina#IR_LZ-ZUE_std#12</name><resource_type>blocking</resource_type></resource><resource><id_resource>266</id_resource><name>FMS-MELS_208</name><resource_type>blocking</resource_type></resource><resource><id_resource>175</id_resource><name>ZG_5#macchina#IR_LZ-ZUE_std#15</name><resource_type>blocking</resource_type></resource><resource><id_resource>670</id_resource><name>KIL-ZWOL_205</name><resource_type>blocking</resource_type></resource><resource><id_resource>547</id_resource><name>TW-NIDB_258</name><resource_type>blocking</resource_type></resource><resource><id_resource>669</id_resource><name>KIL-ZWOL_206</name><resource_type>blocking</resource_type></resource><resource><id_resource>267</id_resource><name>FMS-MELS_204</name><resource_type>blocking</resource_type></resource><resource><id_resource>476</id_resource><name>BIL_73</name><resource_type>blocking</resource_type></resource><resource><id_resource>147</id_resource><name>BIL_74</name><resource_type>blocking</resource_type></resource><resource><id_resource>396</id_resource><name>ZIZS_901</name><resource_type>blocking</resource_type></resource><resource><id_resource>349</id_resource><name>LA-SIB_143</name><resource_type>blocking</resource_type></resource><resource><id_resource>348</id_resource><name>LA-SIB_142</name><resource_type>blocking</resource_type></resource><resource><id_resource>591</id_resource><name>BAA_92</name><resource_type>blocking</resource_type></resource><resource><id_resource>446</id_resource><name>FMS_33</name><resource_type>blocking</resource_type></resource><resource><id_resource>427</id_resource><name>LQ-ROR_411</name><resource_type>blocking</resource_type></resource><resource><id_resource>347</id_resource><name>LA-SIB_141</name><resource_type>blocking</resource_type></resource><resource><id_resource>710</id_resource><name>BAA_93</name><resource_type>blocking</resource_type></resource><resource><id_resource>419</id_resource><name>ZIZS_906</name><resource_type>blocking</resource_type></resource><resource><id_resource>11</id_resource><name>LITT_62</name><resource_type>blocking</resource_type></resource><resource><id_resource>717</id_resource><name>LITT_61</name><resource_type>blocking</resource_type></resource><resource><id_resource>297</id_resource><name>TW_GD</name><resource_type>blocking</resource_type></resource><resource><id_resource>151</id_resource><name>HG_3</name><resource_type>blocking</resource_type></resource><resource><id_resource>809</id_resource><name>ZUE_W3</name><resource_type>blocking</resource_type></resource><resource><id_resource>588</id_resource><name>BAA_1</name><resource_type>blocking</resource_type></resource><resource><id_resource>237</id_resource><name>WN-MH_227</name><resource_type>blocking</resource_type></resource><resource><id_resource>161</id_resource><name>HG_4</name><resource_type>blocking</resource_type></resource><resource><id_resource>238</id_resource><name>WN-MH_226</name><resource_type>blocking</resource_type></resource><resource><id_resource>713</id_resource><name>BAA_3</name><resource_type>blocking</resource_type></resource><resource><id_resource>236</id_resource><name>WN-MH_228</name><resource_type>blocking</resource_type></resource><resource><id_resource>680</id_resource><name>ZEN_12</name><resource_type>blocking</resource_type></resource><resource><id_resource>512</id_resource><name>FRB-BAE_230</name><resource_type>blocking</resource_type></resource><resource><id_resource>629</id_resource><name>ZEN_11</name><resource_type>blocking</resource_type></resource><resource><id_resource>139</id_resource><name>MOLS_1#macchina#S4_BU-SA-UZ_std#215</name><resource_type>blocking</resource_type></resource><resource><id_resource>531</id_resource><name>AU-HG_219</name><resource_type>blocking</resource_type></resource><resource><id_resource>532</id_resource><name>AU-HG_218</name><resource_type>blocking</resource_type></resource><resource><id_resource>234</id_resource><name>WN_3</name><resource_type>blocking</resource_type></resource><resource><id_resource>487</id_resource><name>SCBU_1</name><resource_type>blocking</resource_type></resource><resource><id_resource>466</id_resource><name>WN_4</name><resource_type>blocking</resource_type></resource><resource><id_resource>511</id_resource><name>FRB-BAE_231</name><resource_type>blocking</resource_type></resource><resource><id_resource>355</id_resource><name>SCBU_2</name><resource_type>blocking</resource_type></resource><resource><id_resource>747</id_resource><name>ZUE_P15</name><resource_type>blocking</resource_type></resource><resource><id_resource>177</id_resource><name>LITT_2</name><resource_type>blocking</resource_type></resource><resource><id_resource>833</id_resource><name>20423#1</name><resource_type>multiple_routings</resource_type></resource><resource><id_resource>85</id_resource><name>SCAE-ZB_735</name><resource_type>blocking</resource_type></resource><resource><id_resource>450</id_resource><name>WAL_24</name><resource_type>blocking</resource_type></resource><resource><id_resource>718</id_resource><name>LITT_1</name><resource_type>blocking</resource_type></resource><resource><id_resource>259</id_resource><name>WAL_23</name><resource_type>blocking</resource_type></resource><resource><id_resource>525</id_resource><name>WAE-AU_223</name><resource_type>blocking</resource_type></resource><resource><id_resource>526</id_resource><name>WAE-AU_222</name><resource_type>blocking</resource_type></resource><resource><id_resource>527</id_resource><name>WAE-AU_221</name><resource_type>blocking</resource_type></resource><resource><id_resource>282</id_resource><name>ZUE-ZAU_151</name><resource_type>blocking</resource_type></resource><resource><id_resource>168</id_resource><name>SA_5#macchina#S4_UZ-SA-BU_std#585</name><resource_type>blocking</resource_type></resource><resource><id_resource>70</id_resource><name>ZB-NOU_557#macchina#S6_SCHD-ZB-RW_std#295</name><resource_type>blocking</resource_type></resource><resource><id_resource>130</id_resource><name>SBG-LITT_422_GreatScott_FullPath</name><resource_type>blocking</resource_type></resource><resource><id_resource>622</id_resource><name>ZUE_T82</name><resource_type>blocking</resource_type></resource><resource><id_resource>592</id_resource><name>BAAN_1</name><resource_type>blocking</resource_type></resource><resource><id_resource>709</id_resource><name>BAAN_2</name><resource_type>blocking</resource_type></resource><resource><id_resource>689</id_resource><name>ZUE_T83</name><resource_type>blocking</resource_type></resource><resource><id_resource>203</id_resource><name>dummy</name><resource_type>blocking</resource_type></resource><resource><id_resource>738</id_resource><name>TW_55</name><resource_type>blocking</resource_type></resource><resource><id_resource>542</id_resource><name>TW_56</name><resource_type>blocking</resource_type></resource><resource><id_resource>771</id_resource><name>RUES_71</name><resource_type>blocking</resource_type></resource><resource><id_resource>661</id_resource><name>RUES_72</name><resource_type>blocking</resource_type></resource><resource><id_resource>48</id_resource><name>RUES_1</name><resource_type>blocking</resource_type></resource><resource><id_resource>68</id_resource><name>UNT_2</name><resource_type>blocking</resource_type></resource><resource><id_resource>258</id_resource><name>WAL_3</name><resource_type>blocking</resource_type></resource><resource><id_resource>663</id_resource><name>RUES_2</name><resource_type>blocking</resource_type></resource><resource><id_resource>457</id_resource><name>UNT_1</name><resource_type>blocking</resource_type></resource><resource><id_resource>122</id_resource><name>WAL_4</name><resource_type>blocking</resource_type></resource><resource><id_resource>614</id_resource><name>PF_66</name><resource_type>blocking</resource_type></resource><resource><id_resource>265</id_resource><name>FMS_24</name><resource_type>blocking</resource_type></resource><resource><id_resource>695</id_resource><name>18827#1</name><resource_type>multiple_routings</resource_type></resource><resource><id_resource>690</id_resource><name>ZUE_T73</name><resource_type>blocking</resource_type></resource><resource><id_resource>260</id_resource><name>WAL-FMS_212</name><resource_type>blocking</resource_type></resource><resource><id_resource>621</id_resource><name>ZUE_T72</name><resource_type>blocking</resource_type></resource><resource><id_resource>549</id_resource><name>NIDB_N13</name><resource_type>blocking</resource_type></resource><resource><id_resource>219</id_resource><name>UZ_2</name><resource_type>blocking</resource_type></resource><resource><id_resource>762</id_resource><name>UZ_3</name><resource_type>blocking</resource_type></resource><resource><id_resource>8</id_resource><name>TW_63</name><resource_type>blocking</resource_type></resource><resource><id_resource>856</id_resource><name>20424#1</name><resource_type>multiple_routings</resource_type></resource><resource><id_resource>576</id_resource><name>TW_64</name><resource_type>blocking</resource_type></resource><resource><id_resource>293</id_resource><name>NIDB_N12</name><resource_type>blocking</resource_type></resource><resource><id_resource>662</id_resource><name>RUES_62</name><resource_type>blocking</resource_type></resource><resource><id_resource>579</id_resource><name>TW-ORDD_312</name><resource_type>blocking</resource_type></resource><resource><id_resource>528</id_resource><name>AU_53</name><resource_type>blocking</resource_type></resource><resource><id_resource>578</id_resource><name>TW-ORDD_311</name><resource_type>blocking</resource_type></resource><resource><id_resource>315</id_resource><name>AU_54</name><resource_type>blocking</resource_type></resource><resource><id_resource>770</id_resource><name>RUES_61</name><resource_type>blocking</resource_type></resource><resource><id_resource>45</id_resource><name>SBG_3</name><resource_type>blocking</resource_type></resource><resource><id_resource>189</id_resource><name>SBG_4</name><resource_type>blocking</resource_type></resource><resource><id_resource>6</id_resource><name>BRAG_4#macchina#RE_ZUE-CH_std#612</name><resource_type>blocking</resource_type></resource><resource><id_resource>613</id_resource><name>PF_76</name><resource_type>blocking</resource_type></resource><resource><id_resource>436</id_resource><name>SA_32</name><resource_type>blocking</resource_type></resource><resource><id_resource>377</id_resource><name>SA_33</name><resource_type>blocking</resource_type></resource><resource><id_resource>570</id_resource><name>SBG_33</name><resource_type>blocking</resource_type></resource><resource><id_resource>245</id_resource><name>TIEF_21</name><resource_type>blocking</resource_type></resource><resource><id_resource>212</id_resource><name>PF_79</name><resource_type>blocking</resource_type></resource><resource><id_resource>7</id_resource><name>BRAG_4#macchina#RE_ZUE-CH_std#615</name><resource_type>blocking</resource_type></resource><resource><id_resource>544</id_resource><name>TW_26</name><resource_type>blocking</resource_type></resource><resource><id_resource>691</id_resource><name>ZUE_T63</name><resource_type>blocking</resource_type></resource><resource><id_resource>213</id_resource><name>PF_72</name><resource_type>blocking</resource_type></resource><resource><id_resource>209</id_resource><name>PF_73</name><resource_type>blocking</resource_type></resource><resource><id_resource>188</id_resource><name>SBG_34</name><resource_type>blocking</resource_type></resource><resource><id_resource>620</id_resource><name>ZUE_T62</name><resource_type>blocking</resource_type></resource><resource><id_resource>210</id_resource><name>PF_74</name><resource_type>blocking</resource_type></resource><resource><id_resource>211</id_resource><name>PF_75</name><resource_type>blocking</resource_type></resource><resource><id_resource>300</id_resource><name>TW_3</name><resource_type>blocking</resource_type></resource><resource><id_resource>59</id_resource><name>LITT_11</name><resource_type>blocking</resource_type></resource><resource><id_resource>299</id_resource><name>TW_33</name><resource_type>blocking</resource_type></resource><resource><id_resource>503</id_resource><name>ALTD-PF_235</name><resource_type>blocking</resource_type></resource><resource><id_resource>30</id_resource><name>FMS_4#macchina#S4_UZ-SA-BU_std#540</name><resource_type>blocking</resource_type></resource><resource><id_resource>253</id_resource><name>UNT_22</name><resource_type>blocking</resource_type></resource><resource><id_resource>96</id_resource><name>SCAE-ZB_735#macchina#S6_RW-ZB-SCHD_std#350</name><resource_type>blocking</resource_type></resource><resource><id_resource>502</id_resource><name>ALTD-PF_236</name><resource_type>blocking</resource_type></resource><resource><id_resource>92</id_resource><name>SCAE-ZB_735#macchina#S6_RW-ZB-SCHD_std#355</name><resource_type>blocking</resource_type></resource><resource><id_resource>543</id_resource><name>TW_6</name><resource_type>blocking</resource_type></resource><resource><id_resource>456</id_resource><name>UNT_21</name><resource_type>blocking</resource_type></resource><resource><id_resource>739</id_resource><name>TW_5</name><resource_type>blocking</resource_type></resource><resource><id_resource>170</id_resource><name>TW_4</name><resource_type>blocking</resource_type></resource><resource><id_resource>515</id_resource><name>HAF-RI_228</name><resource_type>blocking</resource_type></resource><resource><id_resource>706</id_resource><name>ZG_13</name><resource_type>blocking</resource_type></resource><resource><id_resource>461</id_resource><name>MG-TIEF_122</name><resource_type>blocking</resource_type></resource><resource><id_resource>217</id_resource><name>PF-RW_703</name><resource_type>blocking</resource_type></resource><resource><id_resource>117</id_resource><name>HGO-SBG_416</name><resource_type>blocking</resource_type></resource><resource><id_resource>132</id_resource><name>HGO_74_GreatScott_FullPath</name><resource_type>blocking</resource_type></resource><resource><id_resource>113</id_resource><name>HGO-SBG_418</name><resource_type>blocking</resource_type></resource><resource><id_resource>1</id_resource><name>HGO-SBG_417</name><resource_type>blocking</resource_type></resource><resource><id_resource>595</id_resource><name>ZG_18</name><resource_type>blocking</resource_type></resource><resource><id_resource>562</id_resource><name>ZUE_Z3</name><resource_type>blocking</resource_type></resource><resource><id_resource>504</id_resource><name>PF_83</name><resource_type>blocking</resource_type></resource><resource><id_resource>338</id_resource><name>PF_85</name><